,tipo_evento,nombre_evento,descripcion,direccion,lon,lat,contacto,accesibilidad,precio,fecha_inicio,fecha_fin,imagen_url,ciudad
0,Museo,Museo Nacional Centro de Arte Reina Sofía,"Uno de los más importantes museos de arte de España para obras realizadas 
desde finales del siglo XIX a la actualidad, principalmente de artistas españoles. La estrella es Guernica de Pablo Picasso.","C/ Santa Isabel, 52 28012 Madrid",-3.6945998175650665,40.40805116002868,www.museoreinasofia.es,"El museo tiene dos accesos, uno en la fachada principal del edificio Sabatini y otro en el edificio Nouvel. Ambos con medidas para facilitar el acceso a las PMR.",Gratuito,2021-07-22,2050-07-22,https://upload.wikimedia.org/wikipedia/commons/d/d9/Madrid_-_Museo_Nacional_Centro_de_Arte_Reina_Sof%C3%ADa_%28MNCARS%29_03.JPG,Madrid
1,Museo,Museo Nacional del Prado,"El Museo Nacional del Prado posee en la actualidad más de siete mil pinturas y alberga colecciones destacadas de 
escultura clásica y moderna, de artes decorativas y de estampas y dibujos.",Paseo del Prado s/n 28014 Madrid,-3.692170017564852,40.41378177936541,www.museodelprado.es,"Las Personas de Movilidad Reducida (PMR) pueden solicitar 72 horas antes, un permiso para estacionar su coche en la plaza exterior del Museo, 
frente a la puerta de Goya.",Gratuito,2021-07-22,2050-07-22,https://upload.wikimedia.org/wikipedia/commons/6/68/Museo_del_Prado_2016_%2825185969599%29.jpg,Madrid
2,Museo,Palacio Real de Madrid,"El Palacio Real de Madrid es la residencia oficial de Su Majestad el Rey de España, que lo emplea en las ceremonias de Estado, 
aunque no habita en él.","C/ Bailén, s/n 28071 Madrid",-3.7143120022211806,40.41795497936503,www.patrimonionacional.es,"Las 2 entradas del Palacio son accesibles para usuarios de silla de ruedas. La entrada de la C/ Bailén es sin desniveles, 
la puerta permanece abierta en horario de visita.",Gratuito,2021-07-22,2050-07-22,https://upload.wikimedia.org/wikipedia/commons/4/40/Palacio_Real_de_Madrid_-_03.jpg,Madrid
3,Museo,Palacio Real de Aranjuez,"Residencia de primavera de los monarcas españoles desde tiempos de Felipe II, fue remodelado y ampliado en el siglo XVIII 
por Felipe V, Fernando VI y Carlos III para convertirlo en un bello palacio.",Plaza de Parejas 28300 Aranjuez (Madrid),-3.60885477339763,40.03643670816857,www.patrimonionacional.es,"La entrada tiene una rampa de 1,50 m de ancho, 1,94 m de longitud y una inclinación pronunciada del 17,6%. No tiene pasamanos pero si un zócalo 
de protección a cada lado de 77 cm de altura.",Gratuito,2021-07-22,2050-07-22,https://upload.wikimedia.org/wikipedia/commons/4/49/Palacio_Real_de_Aranjuez_%285%29.jpg,Aranjuez (Madrid)
4,Museo,Real Monasterio de San Lorenzo del Escorial,"El Monasterio de El Escorial 
fue fundado por Felipe II con la intención de construir un mausoleo para su padre, Carlos V, y como monumento conmemorativo de 
la victoria de San Quintín.",Paseo de Juan Borbón y Battenberg s/n 28200 San Lorenzo del Escorial (Madrid),-4.147716073379687,40.58913854846469,www.patrimonionacional.es,"Las PMR inician la visita a los salones de la planta baja por otra puerta de acceso. La puerta de acceso alternativa 
la abre el personal de atención, si se solicita a la hora de comprar el billete.",Gratuito,2021-07-22,2050-07-22,http://turismomadrid.es/images/Portada/2020/02/monasterio-san-lorenzo-virtual-art-2020.jpg,San Lorenzo del Escorial (Madrid)
