,Title,Year,Rated,Released,Runtime,Genre,Director,Writer,Actors,Plot,Language,Country,Awards,Poster,Ratings,Metascore,imdbRating,imdbVotes,imdbID,Type,DVD,BoxOffice,Production,Website,Response,Error
505,Mother,1926,Not Rated,29 May 1934,89 min,Drama,Vsevolod Pudovkin,"Maxim Gorky (novel), Nathan Zarkhi","Vera Baranovskaya, Nikolay Batalov, Aleksandr Chistyakov, Anna Zemtsova","A story about a family torn apart by a worker's strike. At first, the mother wants to protect her family from the troublemakers, but eventually she realizes that her son is right and the workers should strike.",None,Soviet Union,N/A,https://m.media-amazon.com/images/M/MV5BY2Q3NzY4OTktYjUyMC00NTQ1LWI3MjgtZTVmZWNjYTVjY2MxL2ltYWdlL2ltYWdlXkEyXkFqcGdeQXVyNjMxMjkwMjI@._V1_SX300.jpg,"[{'Source': 'Internet Movie Database', 'Value': '7.5/10'}]",N/A,7.5,"2,554",tt0017128,movie,N/A,N/A,N/A,N/A,True,
506,Metropolis,1927,Not Rated,13 Mar 1927,153 min,"Drama, Sci-Fi",Fritz Lang,"Thea von Harbou (screenplay), Thea von Harbou (novel)","Alfred Abel, Gustav Fröhlich, Rudolf Klein-Rogge, Fritz Rasp","In a futuristic city sharply divided between the working class and the city planners, the son of the city's mastermind falls in love with a working-class prophet who predicts the coming of a savior to mediate their differences.","None, German",Germany,6 wins & 6 nominations.,https://m.media-amazon.com/images/M/MV5BMTg5YWIyMWUtZDY5My00Zjc1LTljOTctYmI0MWRmY2M2NmRkXkEyXkFqcGdeQXVyMTMxODk2OTU@._V1_SX300.jpg,"[{'Source': 'Internet Movie Database', 'Value': '8.3/10'}, {'Source': 'Rotten Tomatoes', 'Value': '97%'}, {'Source': 'Metacritic', 'Value': '98/100'}]",98,8.3,"162,440",tt0017136,movie,21 Dec 2016,"$1,236,166",Paramount,N/A,True,
507,Miss Mend,1926,N/A,26 Oct 1926,250 min,"Adventure, Comedy, Crime, Romance, Sci-Fi","Boris Barnet, Fyodor Otsep","Boris Barnet, Fyodor Otsep, Vasili Sakhnovsky, Marietta Shaginyan (novel)","Natalya Glan, Igor Ilyinsky, Vladimir Fogel, Boris Barnet",Three reporters and an office girl are trying to stop a bacteriological strike by some powerful western business leaders against the USSR.,"None, Russian",Soviet Union,N/A,https://m.media-amazon.com/images/M/MV5BMTcwNDIwNTYzNl5BMl5BanBnXkFtZTgwMjYyNTYxMjE@._V1_SX300.jpg,"[{'Source': 'Internet Movie Database', 'Value': '6.9/10'}, {'Source': 'Rotten Tomatoes', 'Value': '50%'}]",N/A,6.9,277,tt0017159,movie,N/A,N/A,N/A,N/A,True,
508,My Lady of Whims,1925,Passed,01 Dec 1925,59 min,Comedy,Dallas M. Fitzgerald,"Edgar Franklin (adapted from the Argosy story ""Protecting Prue"" by), Doris Schroeder","Clara Bow, Carmelita Geraghty, Betty Baker, Donald Keith","Clara plays wealthy Prudence Severin, whose reckless, profligate behavior causes nothing but headaches for her father. A detective (Lee Moran) is hired to protect Prudence from herself, but to no avail.","None, English",USA,N/A,https://m.media-amazon.com/images/M/MV5BZDE0ZWNiMmEtOGQ3Yi00YjQ0LTg5NjAtNTllZmExMjY5YTc1XkEyXkFqcGdeQXVyNDY1NzU5NjY@._V1_SX300.jpg,"[{'Source': 'Internet Movie Database', 'Value': '5.7/10'}]",N/A,5.7,106,tt0017184,movie,N/A,N/A,N/A,N/A,True,
509,Honor,1925,N/A,N/A,62 min,Drama,Amo Bek-Nazaryan,"Alexander Shirvanzade (novel), Amo Bek-Nazaryan","Hovhannes Abelyan, Hasmik Agopyan, Olga Maisuryan, Hrachia Nersisyan","Young lovers Seyran and Susan meet a tragic fate because of patriarchal prejudices of their parents. Although arranged for marriage in early childhood, and despite youngsters' love, ...","None, Sign Languages",Soviet Union,N/A,https://m.media-amazon.com/images/M/MV5BZTEzMDFjMmMtMzYxYS00NDg5LTk4OTktN2UzYzNhMzcyZDBlXkEyXkFqcGdeQXVyMjI3NTI3Njc@._V1_SX300.jpg,"[{'Source': 'Internet Movie Database', 'Value': '6.9/10'}]",N/A,6.9,117,tt0017195,movie,N/A,N/A,N/A,N/A,True,
510,Nana,1926,Not Rated,25 Jun 1926,150 min,"Drama, Romance",Jean Renoir,"Pierre Lestringuez (scenario), Émile Zola (inspired by the novel by), Denise Leblond (intertitles)","Catherine Hessling, Pierre Lestringuez, Jacqueline Forzane, Werner Krauss","When the vivacious and beautiful Nana bombs at the Théâtre des Variétés, she embarks on the life of a courtesan, using her allure and charisma to entice and pleasure men.","None, French",France,N/A,https://m.media-amazon.com/images/M/MV5BODIzMDExMTA4NV5BMl5BanBnXkFtZTgwODkzOTA5MTE@._V1_SX300.jpg,"[{'Source': 'Internet Movie Database', 'Value': '6.8/10'}, {'Source': 'Rotten Tomatoes', 'Value': '67%'}]",N/A,6.8,725,tt0017196,movie,N/A,N/A,N/A,N/A,True,
511,Nell Gwyn,1926,N/A,03 Jan 1927,80 min,"Biography, Drama, History, Romance",Herbert Wilcox,"J.W. McConaughty (titles), Joseph Shearing (novel), Herbert Wilcox (scenario)","Dorothy Gish, Randle Ayrton, Juliette Compton, Sydney Fairbrother",An actress becomes the king's mistress and persuades him to convert the palace to a serviceman's home.,"None, English",UK,N/A,https://m.media-amazon.com/images/M/MV5BZTRlZWNlNTYtMWY5Zi00YzA1LTkyZTMtOWUxN2UyMGJiNGMzXkEyXkFqcGdeQXVyMjcxNjI4NTk@._V1_SX300.jpg,"[{'Source': 'Internet Movie Database', 'Value': '5.3/10'}]",N/A,5.3,232,tt0017198,movie,N/A,N/A,Paramount Pictures,N/A,True,
512,Old Ironsides,1926,N/A,06 Dec 1926,111 min,"Drama, History",James Cruze,"Laurence Stallings (story), Harry Carr (suggested and adapted by), Walter Woods (suggested and adapted by), Rupert Hughes (titles)","Charles Farrell, Esther Ralston, Wallace Beery, George Bancroft",An American fighting ship battles Barbary pirates in the Mediterranean in the 18th century.,None,USA,N/A,https://m.media-amazon.com/images/M/MV5BMjIwMmEwMjMtODg4ZC00YjQwLWFhMDQtZjMzNjkwZmRjNjE5XkEyXkFqcGdeQXVyNjA5MTAzODY@._V1_SX300.jpg,"[{'Source': 'Internet Movie Database', 'Value': '6.6/10'}, {'Source': 'Rotten Tomatoes', 'Value': '60%'}]",N/A,6.6,195,tt0017226,movie,N/A,"$1,434,461","Paramount Pictures, Famous Players-Lasky Corporation",N/A,True,
513,By the Law,1926,N/A,03 Dec 1926,80 min,Drama,Lev Kuleshov,"Lev Kuleshov, Jack London (story ""The Unexpected""), Viktor Shklovskiy","Aleksandra Khokhlova, Sergey Komarov, Vladimir Fogel, Pyotr Galadzhev","A five-person team of gold prospectors in the Yukon has just begun to enjoy great success when one of the members snaps, and suddenly kills two of the others. The two survivors, a husband ...","None, Russian",Soviet Union,N/A,https://m.media-amazon.com/images/M/MV5BOTkyZTM0YjQtZDNmZC00Y2I4LTgzNjUtY2NlNGI3N2FmNmUzXkEyXkFqcGdeQXVyNTEzMzAyOTQ@._V1_SX300.jpg,"[{'Source': 'Internet Movie Database', 'Value': '7.7/10'}, {'Source': 'Rotten Tomatoes', 'Value': '100%'}]",N/A,7.7,965,tt0017271,movie,N/A,N/A,N/A,N/A,True,
514,Three Thieves,1926,N/A,29 Oct 1933,66 min,Comedy,Yakov Protazanov,"Umberto Notari (novel), Yakov Protazanov","Olga Zhizneva, Nikolai Prozorovsky, Vladimir Fogel, Daniil Vvedenskiy","Who is a thief - a street pickpocket, a social lion or a banker? The thief is the one who takes it small, the man with prospects is called a winner.",None,Soviet Union,N/A,https://m.media-amazon.com/images/M/MV5BNDE3NDc2MWEtNTE1ZC00MmI1LTkyMDItY2I3YzM2YTRiNDI3L2ltYWdlL2ltYWdlXkEyXkFqcGdeQXVyNjMxMjkwMjI@._V1_SX300.jpg,"[{'Source': 'Internet Movie Database', 'Value': '7.0/10'}]",N/A,7.0,138,tt0017293,movie,N/A,N/A,N/A,N/A,True,
515,The Road to Mandalay,1926,Passed,28 Jun 1926,70 min,Drama,Tod Browning,"Tod Browning (story), Joseph Farnham (titles), Herman J. Mankiewicz (story), Ludwig Meier (subtitle translation)","Lon Chaney, Lois Moran, Owen Moore, Henry B. Walthall","A former captain tries to reunite with his daughter, twenty years after leaving her as an infant.","None, English",USA,N/A,https://m.media-amazon.com/images/M/MV5BOTIwOTgxNmMtODk4ZS00YTE0LThhMGEtZTMxYjk4NzE4OWZjXkEyXkFqcGdeQXVyMTQ2MjQyNDc@._V1_SX300.jpg,"[{'Source': 'Internet Movie Database', 'Value': '6.6/10'}]",N/A,6.6,152,tt0017329,movie,N/A,N/A,N/A,N/A,True,
516,Der Rosenkavalier,1925,N/A,10 Jan 1926,105 min,Comedy,Robert Wiene,"Louis Nerz, Robert Wiene, Hugo von Hofmannsthal","Michael Bohnen, Huguette Duflos, Paul Hartmann, Jaque Catelain",N/A,German,Austria,N/A,https://m.media-amazon.com/images/M/MV5BMTk4NjE3MTA0MF5BMl5BanBnXkFtZTgwMjQxMTYxMjE@._V1_SX300.jpg,"[{'Source': 'Internet Movie Database', 'Value': '5.9/10'}]",N/A,5.9,66,tt0017338,movie,N/A,N/A,N/A,N/A,True,
517,The Scarlet Letter,1926,Passed,08 Jan 1927,115 min,Drama,Victor Sjöström,"Nathaniel Hawthorne (novel), Frances Marion (adaptation), Frances Marion (titles)","Lillian Gish, Lars Hanson, Henry B. Walthall, Karl Dane","After having a child out of wedlock, a young Puritan woman is pressured to reveal the name of her lover.","None, English",USA,N/A,https://m.media-amazon.com/images/M/MV5BYThlNDM2MjAtZGY5Yy00MjdlLTgyMzUtYjQyYWIxNDgwNzBkXkEyXkFqcGdeQXVyMDI2NDg0NQ@@._V1_SX300.jpg,"[{'Source': 'Internet Movie Database', 'Value': '7.6/10'}, {'Source': 'Rotten Tomatoes', 'Value': '80%'}]",N/A,7.6,"1,570",tt0017350,movie,N/A,N/A,Metro-Goldwyn-Mayer,N/A,True,
518,The Sea Beast,1926,N/A,15 Jan 1926,136 min,"Action, Adventure, Fantasy, Romance",Millard Webb,"Herman Melville (novel), Bess Meredyth","John Barrymore, Dolores Costello, George O'Hara, Mike Donlin",This silent movie is based on Melville's classic Moby Dick. Ahab and his brother compete for the affections of minister's daughter Esther. But the great white whale has been eluding the ...,English,USA,N/A,https://m.media-amazon.com/images/M/MV5BM2U1NjA4OTYtOTA0OC00N2MzLTk3ZGYtOGZiY2E0NTc0NTMwXkEyXkFqcGdeQXVyMzg1ODEwNQ@@._V1_SX300.jpg,"[{'Source': 'Internet Movie Database', 'Value': '6.6/10'}, {'Source': 'Rotten Tomatoes', 'Value': '67%'}]",N/A,6.6,124,tt0017354,movie,N/A,N/A,Warner Bros.,N/A,True,
519,The Shamrock Handicap,1926,Passed,02 May 1926,66 min,"Romance, Drama",John Ford,"Peter B. Kyne (from the story by), Elizabeth Pickett (titles), John Stone (scenario)","Janet Gaynor, Leslie Fenton, Willard Louis, J. Farrell MacDonald","The story of Sir Miles O'Hara and his daughter, who rent out living quarters to a poor family, the O'Sheas, who cannot pay rent on time.","None, English",USA,N/A,https://m.media-amazon.com/images/M/MV5BN2NjN2Y5NzUtZWY3MC00NWMyLThjMmEtNjRlZmJkMGYyNjJlXkEyXkFqcGdeQXVyNzU3NjUzNTc@._V1_SX300.jpg,"[{'Source': 'Internet Movie Database', 'Value': '5.9/10'}]",N/A,5.9,131,tt0017374,movie,N/A,N/A,N/A,N/A,True,
520,The Overcoat,1926,N/A,10 May 1926,84 min,Drama,"Grigoriy Kozintsev, Leonid Trauberg","Nikolay Gogol (novel), Yuri Tynyanov","Antonina Eremeeva, Emil Gal, Sergey Gerasimov, Andrei Kapler","One of the most acknowledged film interpretations of classic short story ""The Overcoat"" (1842) by Nikolai Gogol, describing a fate of a ""small person"".",None,Soviet Union,N/A,https://m.media-amazon.com/images/M/MV5BYjI4YzFhMmYtMTZiYS00ZGUyLThlMGYtZjhmYmFlYzc5YzcwXkEyXkFqcGdeQXVyMjU0MjU2MjI@._V1_SX300.jpg,"[{'Source': 'Internet Movie Database', 'Value': '6.7/10'}]",N/A,6.7,296,tt0017378,movie,N/A,N/A,N/A,N/A,True,
521,The Show-Off,1926,Passed,16 Aug 1926,82 min,"Comedy, Drama",Malcolm St. Clair,"George Kelly (from the comedy by), Pierre Collings (screen play)","Ford Sterling, Claire McDowell, Charles Goodrich, Lois Wilson",A blowhard who poses as a railroad executive (but is really just a $30-a-week clerk) catches a young bride and then drives her family's finances to the brink of ruin.,"None, English",USA,N/A,https://m.media-amazon.com/images/M/MV5BMTUyNjIwMzE2Ml5BMl5BanBnXkFtZTYwNzc5NDk4._V1_SX300.jpg,"[{'Source': 'Internet Movie Database', 'Value': '6.8/10'}, {'Source': 'Rotten Tomatoes', 'Value': '59%'}]",N/A,6.8,254,tt0017382,movie,N/A,N/A,Metro-Goldwyn-Mayer,N/A,True,
522,So This Is Paris,1926,Passed,31 Jul 1926,80 min,Comedy,Ernst Lubitsch,"Henri Meilhac (play), Ludovic Halévy (play), Hanns Kräly (screen adaptation), Rob Wagner (titles), Robert E. Hopkins (titles)","Monte Blue, Patsy Ruth Miller, Lilyan Tashman, George Beranger",The first movie to ever depict a choreographed dance scene in a silent movie. The Charleston!,"None, English",USA,N/A,https://m.media-amazon.com/images/M/MV5BMTUyMjcxMjA5Ml5BMl5BanBnXkFtZTgwNzU1NjYxMjE@._V1_SX300.jpg,"[{'Source': 'Internet Movie Database', 'Value': '7.0/10'}]",N/A,7.0,325,tt0017409,movie,N/A,N/A,Warner Bros. Pictures,N/A,True,
523,So's Your Old Man,1926,N/A,25 Oct 1926,67 min,Comedy,Gregory La Cava,"J. Clarkson Miller, Howard Emmett Rogers (adaptation), Julian Street (story ""Mr. Bisbee's Princess"")","W.C. Fields, Alice Joyce, Charles 'Buddy' Rogers, Kittens Reichert",Poor glazier Sam Bisbee has invented break-proof glass. He intends to show it off to a convention of automobile men. Due to a mixup his car is switched with another and his demonstration ...,"None, English",USA,1 win.,https://m.media-amazon.com/images/M/MV5BNDE5NmI4YWItODFiOS00M2NiLTg2NjItMTM4OGJjOTQ5ODBmXkEyXkFqcGdeQXVyMjQ3MTQ1MTg@._V1_SX300.jpg,"[{'Source': 'Internet Movie Database', 'Value': '6.1/10'}]",N/A,6.1,169,tt0017410,movie,N/A,N/A,N/A,N/A,True,
524,The Son of the Sheik,1926,Passed,05 Sep 1926,68 min,"Adventure, Drama, Romance",George Fitzmaurice,"Edith Maude Hull (based on the novel by), Frances Marion (screen adaptation), Frédérique De Grésac (screen adaptation), George Marion Jr. (titles)","Rudolph Valentino, Vilma Bánky, George Fawcett, Montagu Love","The son of the sheik and a dancing girl fall in love, but when he is made to believe she has betrayed him he seeks revenge.","None, English",USA,1 win.,https://m.media-amazon.com/images/M/MV5BNzY0MWQwNjQtMzg1YS00ZWQzLTlhMWMtNTU2ZTUxZDZlNTRlXkEyXkFqcGdeQXVyNjc0MzMzNjA@._V1_SX300.jpg,"[{'Source': 'Internet Movie Database', 'Value': '6.6/10'}, {'Source': 'Rotten Tomatoes', 'Value': '78%'}]",N/A,6.6,"1,825",tt0017416,movie,02 Jul 2002,"$1,562,733",Feature Productions,N/A,True,
525,The Sorrows of Satan,1926,Passed,12 Oct 1926,90 min,"Drama, Romance",D.W. Griffith,"Marie Corelli (novel), John Russell (adaptation), Forrest Halsey (screenplay), Julian Johnson (titles)","Adolphe Menjou, Ricardo Cortez, Carol Dempster, Lya De Putti","Geoffrey, a young and impoverished writer, is desperately in love with Mavis, who lives at his boardinghouse and is also pursuing a writing career. Unable to marry her because of his ...","None, English",USA,N/A,https://m.media-amazon.com/images/M/MV5BMTEwNjc0ODMxMjdeQTJeQWpwZ15BbWU4MDI2NTY2MTIx._V1_SX300.jpg,"[{'Source': 'Internet Movie Database', 'Value': '6.0/10'}]",N/A,6.0,212,tt0017419,movie,N/A,N/A,Paramount Pictures,N/A,True,
526,Sparrows,1926,Unrated,N/A,109 min,Drama,"William Beaudine, Tom McNamara","Winifred Dunn (story), George Marion Jr. (titles), C. Gardner Sullivan (adaptation)","Mary Pickford, Roy Stewart, Mary Louise Miller, Gustav von Seyffertitz","Molly, the eldest child at a baby farm hidden deep in a swamp, must rescue the others when their cruel master decides that one of them will be disposed of.","None, English",USA,N/A,https://m.media-amazon.com/images/M/MV5BMTY3MTkyMTc0MF5BMl5BanBnXkFtZTgwOTI5MDgwMjE@._V1_SX300.jpg,"[{'Source': 'Internet Movie Database', 'Value': '7.3/10'}, {'Source': 'Rotten Tomatoes', 'Value': '88%'}]",N/A,7.3,"1,173",tt0017423,movie,16 Jul 2016,N/A,Pickford Corporation,N/A,True,
527,The Strong Man,1926,N/A,19 Sep 1926,75 min,Comedy,Frank Capra,"Arthur Ripley (story), Hal Conklin (adapted by), Robert Eddy (adapted by), Reed Heustis (titles by), Clarence Hennecke (adaptation), James Langdon (adaptation), Tim Whelan (adaptation)","Harry Langdon, Priscilla Bonner, Gertrude Astor, William V. Mong","A meek Belgian soldier, fighting in World War I, receives a letter and a photo from ""Mary Brown"", an American girl he has never met. After the war, he travels to America searching for her.","None, English",USA,1 win.,https://m.media-amazon.com/images/M/MV5BMTYyMjE0OTQ2NF5BMl5BanBnXkFtZTcwNTUxMDIzMQ@@._V1_SX300.jpg,"[{'Source': 'Internet Movie Database', 'Value': '6.6/10'}, {'Source': 'Rotten Tomatoes', 'Value': '85%'}]",N/A,6.6,786,tt0017437,movie,N/A,N/A,N/A,N/A,True,
528,The Man Who Cheated Life,1926,N/A,26 Dec 1926,110 min,"Drama, Horror",Henrik Galeen,"Hanns Heinz Ewers (novel), Henrik Galeen (book)","Conrad Veidt, Elizza La Porta, Fritz Alberti, Ágnes Eszterházy","For Balduin, going out to beer parties with his fellow students and fighting out disputes at the tip of the sword have lost their charms. He wants to find love; but how would he, a ...","None, German",Germany,N/A,https://m.media-amazon.com/images/M/MV5BMTkzNGRhMDMtYWZmMS00OGQxLTliNTEtMTlkOTRkYmEyZDFmXkEyXkFqcGdeQXVyMzg2MzE2OTE@._V1_SX300.jpg,"[{'Source': 'Internet Movie Database', 'Value': '6.9/10'}]",N/A,6.9,598,tt0017438,movie,N/A,N/A,Sokal-Film GmbH,N/A,True,
529,Tartuffe,1925,Not Rated,24 Jul 1927,70 min,Drama,F.W. Murnau,"Molière (play), Carl Mayer (manuscript)","Hermann Picha, Rosa Valetti, André Mattoni, Werner Krauss","A young man shows his millionaire grandfather a film based on Molière's Tartuffe, in order to expose the old man's hypocritical governess who covets his own inheritance.","None, German",Germany,N/A,https://m.media-amazon.com/images/M/MV5BZDhlYmIxNWYtMzg1Yy00Y2YzLWE5ODktNzZlYjg5MDU0NmNhXkEyXkFqcGdeQXVyMzg1ODEwNQ@@._V1_SX300.jpg,"[{'Source': 'Internet Movie Database', 'Value': '7.1/10'}, {'Source': 'Rotten Tomatoes', 'Value': '88%'}]",N/A,7.1,"2,205",tt0017448,movie,N/A,N/A,N/A,N/A,True,
530,The Temptress,1926,Passed,03 Oct 1926,62 min,"Drama, Romance","Fred Niblo, Mauritz Stiller","Vicente Blasco Ibáñez, Dorothy Farnum (scenario), Marian Ainslee (titles)","Greta Garbo, Antonio Moreno, Marc McDermott, Lionel Barrymore",An architect tries suppressing his passion for a seductive woman.,"None, English",USA,N/A,https://m.media-amazon.com/images/M/MV5BMzZmMjAwNWYtMWFhMy00ZDQ5LWJkMjAtNTIxNWU3MjVkNjNjXkEyXkFqcGdeQXVyMzE0MjY5ODA@._V1_SX300.jpg,"[{'Source': 'Internet Movie Database', 'Value': '6.9/10'}, {'Source': 'Rotten Tomatoes', 'Value': '66%'}]",N/A,6.9,"1,097",tt0017449,movie,25 Dec 2015,N/A,"Metro Goldwyn Mayer, Cosmopolitan Productions",N/A,True,
531,3 Bad Men,1926,Unrated,28 Aug 1926,122 min,"Romance, Western",John Ford,"Herman Whitaker (suggested by the novel: ""Over the Border""), John Stone (adaptation), Ralph Spence (titles), Malcolm Stuart Boylan (titles), John Stone (scenario)","George O'Brien, Olive Borden, Lou Tellegen, Tom Santschi",Three outlaws come to the aid of a young girl after her father is killed.,"None, English",USA,N/A,https://m.media-amazon.com/images/M/MV5BMWU4MWNkYWEtMjI0OC00MWE1LWJmNjEtNmQ4Yjk1ZWRlNTM3XkEyXkFqcGdeQXVyNjc1NTYyMjg@._V1_SX300.jpg,"[{'Source': 'Internet Movie Database', 'Value': '7.5/10'}, {'Source': 'Rotten Tomatoes', 'Value': '68%'}]",N/A,7.5,"1,058",tt0017463,movie,06 Apr 2014,N/A,N/A,N/A,True,
532,Torrent,1926,Passed,08 Feb 1926,88 min,"Drama, Romance",Monta Bell,"Vicente Blasco Ibáñez (from the novel by), Dorothy Farnum (adapted for the screen by), Katherine Hilliker (titles), H.H. Caldwell (titles)","Ricardo Cortez, Greta Garbo, Gertrude Olmstead, Edward Connelly","A young girl and her father are kicked out of their house by a cruel noblewoman, and the girl's heart is broken when her sweetheart, the noblewoman's son, won't go to Paris with them. After...","None, English",USA,N/A,https://m.media-amazon.com/images/M/MV5BZWRhMzA2NjgtNGIxYS00ZGVjLTg4NzctNzBjNDgyZjAzZTk2XkEyXkFqcGdeQXVyMjcxNjI4NTk@._V1_SX300.jpg,"[{'Source': 'Internet Movie Database', 'Value': '6.9/10'}, {'Source': 'Rotten Tomatoes', 'Value': '50%'}]",N/A,6.9,710,tt0017480,movie,11 Jan 2011,N/A,"Metro-Goldwyn-Mayer, Cosmopolitan Productions",N/A,True,
533,"Tramp, Tramp, Tramp",1926,Passed,21 Mar 1926,62 min,"Adventure, Comedy, Romance",Harry Edwards,N/A,"Harry Langdon, Joan Crawford, Edwards Davis, Tom Murray","Low-life Harry falls in love with sweet Betty who inspires him to improve himself so he can marry her. He enters a $25,000 cross-country hiking contest. After many adventures he wins, pays ...","None, English",USA,N/A,https://m.media-amazon.com/images/M/MV5BYjVkNGUyYjAtMTlmMi00NWUzLWI0ZmItNDQ4ZjI0YmEzMDJmXkEyXkFqcGdeQXVyMjM5NDM1MTE@._V1_SX300.jpg,"[{'Source': 'Internet Movie Database', 'Value': '6.1/10'}, {'Source': 'Rotten Tomatoes', 'Value': '60%'}]",N/A,6.1,620,tt0017483,movie,N/A,"$243,700",N/A,N/A,True,
534,The Volga Boatman,1926,Passed,23 May 1926,120 min,"Drama, Romance",Cecil B. DeMille,"Konrad Bercovici (novel), Lenore J. Coffee (adaptation)","William Boyd, Elinor Fair, Robert Edeson, Victor Varconi","During the Revolution Princess Vera, though betrothed to Prince Dimitri, is attracted to the peasant Feodor.","None, English",USA,N/A,https://m.media-amazon.com/images/M/MV5BMjRlYzlhOGEtZjIzOS00NDk3LWE0MGUtMzA5MjNkNWYwZmYwXkEyXkFqcGdeQXVyNjc1NTYyMjg@._V1_SX300.jpg,"[{'Source': 'Internet Movie Database', 'Value': '6.6/10'}]",N/A,6.6,126,tt0017519,movie,17 Jun 1997,N/A,Producers Distributing Corporation (PDC),N/A,True,
535,West Point,1927,Passed,07 Jan 1928,95 min,"Drama, Romance, Sport",Edward Sedgwick,"Raymond L. Schrock (story and continuity), Joseph Farnham (titles by)","William Haines, Joan Crawford, William Bakewell, Neil Neely","Wealthy Brice Wayne enters West Point and, though he does well on the football field, angers fellow cadets with his arrogance. Disciplined by the coach he yells ""To hell with the Corps!"" ...",None,USA,N/A,https://m.media-amazon.com/images/M/MV5BMTg4MDQzMDM5N15BMl5BanBnXkFtZTcwMjczMDAyMw@@._V1_SX300.jpg,"[{'Source': 'Internet Movie Database', 'Value': '6.5/10'}, {'Source': 'Rotten Tomatoes', 'Value': '50%'}]",N/A,6.5,"1,719",tt0017534,movie,17 Nov 2009,N/A,Metro-Goldwyn-Mayer,N/A,True,
536,What Price Glory,1926,N/A,23 Nov 1926,116 min,"Comedy, Drama, War",Raoul Walsh,"Maxwell Anderson (play), Malcolm Stuart Boylan (titles), James T. O'Donohoe, Laurence Stallings (play)","Edmund Lowe, Victor McLaglen, Dolores del Rio, William V. Mong","U.S. Marine sergeants Quirt and Flagg are inveterate romantic rivals on peacetime assignments in China and the Philippines. In 1917, W.W. I brings them to France, where Flagg, now a captain...",N/A,USA,N/A,https://m.media-amazon.com/images/M/MV5BYWY2MTkwNzUtYjkwYy00YjA1LTgzOTItZmY1ZDMyMGE5ZTExXkEyXkFqcGdeQXVyMjUxODE0MDY@._V1_SX300.jpg,"[{'Source': 'Internet Movie Database', 'Value': '7.2/10'}, {'Source': 'Rotten Tomatoes', 'Value': '100%'}]",N/A,7.2,308,tt0017540,movie,N/A,N/A,Fox Film Corporation,N/A,True,
537,The Winning of Barbara Worth,1926,Not Rated,14 Oct 1926,89 min,"Drama, Romance, Western",Henry King,"Rupert Hughes (titles), Frances Marion (adaptation), Harold Bell Wright (novel)","Ronald Colman, Vilma Bánky, Gary Cooper, Charles Lane","While building an irrigation system for a Southwestern desert community, an engineer vies with a local cowboy for the affections of a rancher's daughter.","None, English, Spanish",USA,N/A,https://m.media-amazon.com/images/M/MV5BMjE3NmQ3YzktNDIzZi00ZjlhLThlMWEtZDYwMzliMTliMDg0L2ltYWdlL2ltYWdlXkEyXkFqcGdeQXVyMjUxODE0MDY@._V1_SX300.jpg,"[{'Source': 'Internet Movie Database', 'Value': '7.0/10'}, {'Source': 'Rotten Tomatoes', 'Value': '40%'}]",N/A,7.0,714,tt0017567,movie,24 Mar 2020,N/A,Samuel Goldwyn Company,N/A,True,
538,Almost Human,1927,Passed,26 Dec 1927,60 min,"Drama, Romance",Frank Urson,"Richard Harding Davis (story ""The Bar Sinister""), Clara Beranger (screenplay), Clara Beranger (titles)","Vera Reynolds, Kenneth Thomson, Majel Coleman, Claire McDowell","John Livingston is a rich mama's-boy, who owns a blooded dog named Paul. Paul meets Maggie Mutt, and Paul, being a pedigree canine and somewhat of a cad, lures trusting Maggie to the barn ...","None, English",USA,N/A,https://m.media-amazon.com/images/M/MV5BYzQ5NTU2YzEtMTQ5NC00NTYyLTk1ZGEtYWYzMzUzNDJmOGFkXkEyXkFqcGdeQXVyMDMxMjQwMw@@._V1_SX300.jpg,"[{'Source': 'Internet Movie Database', 'Value': '7.5/10'}]",N/A,7.5,338,tt0017619,movie,N/A,N/A,N/A,N/A,True,
539,A Daughter of Destiny,1928,N/A,01 May 1928,108 min,"Drama, Fantasy, Horror, Sci-Fi",Henrik Galeen,"Hanns Heinz Ewers (novel), Henrik Galeen","Brigitte Helm, Paul Wegener, Iván Petrovich, Wolfgang Zilzer","A scientist interested in the laws of heredity, impregnates a prostitute in a laboratory with the semen of a hanged murderer. The prostitute conceives a female child who has no concept of love, whom the professor adopts.","None, German",Germany,N/A,https://m.media-amazon.com/images/M/MV5BNWM1MzIwYmEtNGE0ZC00YTI4LTgzYWQtNmNmNjYyNDRkMTcwXkEyXkFqcGdeQXVyMTQ2MjQyNDc@._V1_SX300.jpg,"[{'Source': 'Internet Movie Database', 'Value': '6.2/10'}, {'Source': 'Rotten Tomatoes', 'Value': '57%'}]",N/A,6.2,301,tt0017621,movie,N/A,N/A,N/A,N/A,True,
540,Annie Laurie,1927,N/A,11 May 1927,90 min,"Drama, Romance",John S. Robertson,"Marian Ainslee (titles), Ruth Cummings (titles), Josephine Lovett (screenplay), Josephine Lovett (story)","Lillian Gish, Norman Kerry, Creighton Hale, Joseph Striker","The story of the famous battle between the Scots clans of Macdonald and Campbell, and the young woman who comes between them, Annie Laurie.","None, English",USA,N/A,https://m.media-amazon.com/images/M/MV5BMTkzNTc2ODE1MV5BMl5BanBnXkFtZTgwODUzOTQ1MzE@._V1_SX300.jpg,"[{'Source': 'Internet Movie Database', 'Value': '5.9/10'}]",N/A,5.9,356,tt0017632,movie,N/A,N/A,Metro,N/A,True,
541,Women of Ryazan,1927,N/A,13 Dec 1927,67 min,Drama,"Ivan Pravov, Olga Preobrazhenskaya","Boris Altshuler, Olga Vishnevskaya","Kuzma Yastrebitsky, Olga Narbekova, Yelena Maksimova, Georgi Bobynin","Orphan Anna lives with her aunt Aliona in the Russian district of Ryazan. One day, they meet Wassily and his son Ivan. In order to marry off his son, Wassily organizes a meeting with all ...",None,Soviet Union,N/A,https://m.media-amazon.com/images/M/MV5BODZiMzQ4MWItMDcyNS00OTAwLTllYWUtM2Q5YzgxODc0NTg0XkEyXkFqcGdeQXVyMzg1ODEwNQ@@._V1_SX300.jpg,"[{'Source': 'Internet Movie Database', 'Value': '7.0/10'}]",N/A,7.0,226,tt0017653,movie,N/A,N/A,N/A,N/A,True,
