,Title,Year,Rated,Released,Runtime,Genre,Director,Writer,Actors,Plot,Language,Country,Awards,Poster,Ratings,Metascore,imdbRating,imdbVotes,imdbID,Type,DVD,BoxOffice,Production,Website,Response,Error
237,Buried Treasure,1921,Passed,10 Apr 1921,70 min,"Adventure, Fantasy, Romance",George D. Baker,"F. Britten Austin (short story), George D. Baker (adaptation)","Marion Davies, Norman Kerry, Anders Randolf, Edith Shayne","Strung around the idea of reincarnation, this film goes back in time to the days of the Spanish galleons and pirates burying their treasure; treasure to be found centuries later.","None, English",USA,N/A,https://m.media-amazon.com/images/M/MV5BMjAxODczODIyMV5BMl5BanBnXkFtZTgwNDA5OTcwMjE@._V1_SX300.jpg,"[{'Source': 'Internet Movie Database', 'Value': '6.4/10'}]",N/A,6.4,167,tt0012016,movie,N/A,N/A,N/A,N/A,True,
238,Camille,1921,Passed,26 Sep 1921,72 min,"Drama, Romance",Ray C. Smallwood,"Alexandre Dumas fils (by), June Mathis (written for the screen by)","Rudolph Valentino, Rex Cherryman, Arthur Hoyt, Zeffie Tilbury","A courtesan and an idealistic young man fall in love, only for her to give up the relationship at his status-conscious father's request.","None, English",USA,N/A,https://m.media-amazon.com/images/M/MV5BOWFiOGEyZjctZDMxMy00NzJmLWIxZGUtZTE1ODVjYmY0YTdkXkEyXkFqcGdeQXVyMzg1ODEwNQ@@._V1_SX300.jpg,"[{'Source': 'Internet Movie Database', 'Value': '6.6/10'}, {'Source': 'Rotten Tomatoes', 'Value': '65%'}]",N/A,6.6,881,tt0012027,movie,28 Jun 2011,N/A,Nazimova Productions,N/A,True,
239,The Conquering Power,1921,TV-G,08 Jul 1921,89 min,"Drama, Romance",Rex Ingram,"June Mathis, Honoré de Balzac (story ""Eugénie Grandet"")","Alice Terry, Rudolph Valentino, Ralph Lewis, Carrie Daumery","After losing his father, a playboy moves in with his miserly uncle, who seeks to cheat him out of his inheritance.",None,USA,N/A,https://m.media-amazon.com/images/M/MV5BZDE2NjhkOTktZWI1OC00MWYwLWE1OGQtNjlmMWY3YmQ5NWI3XkEyXkFqcGdeQXVyNDY1NzU5NjY@._V1_SX300.jpg,"[{'Source': 'Internet Movie Database', 'Value': '6.7/10'}, {'Source': 'Rotten Tomatoes', 'Value': '56%'}]",N/A,6.7,422,tt0012068,movie,18 Sep 2016,N/A,Metro Pictures Corporation,N/A,True,
240,Dream Street,1921,Passed,12 Apr 1921,102 min,"Comedy, Drama, Romance",D.W. Griffith,"Thomas Burke (short story collection ""Limehouse Nights""), D.W. Griffith","Carol Dempster, Ralph Graves, Charles Emmett Mack, Edward Peil Sr.",Three men in London compete for the love of a dance-hall girl.,N/A,USA,N/A,https://m.media-amazon.com/images/M/MV5BMzI3Mzk4MzMzM15BMl5BanBnXkFtZTgwNzM3Njk5MTE@._V1_SX300.jpg,"[{'Source': 'Internet Movie Database', 'Value': '5.5/10'}]",N/A,5.5,139,tt0012122,movie,N/A,N/A,N/A,N/A,True,
241,Ducks and Drakes,1921,N/A,01 Feb 1921,N/A,"Comedy, Romance",Maurice Campbell,"Elmer Harris (screenplay), Elmer Harris (story)","Bebe Daniels, Jack Holt, Mayme Kelso, Edward Martindel",N/A,English,USA,N/A,N/A,[],N/A,N/A,N/A,tt0012125,movie,N/A,N/A,Realart Pictures Corporation,N/A,True,
242,Eldorado,1921,N/A,28 Oct 1921,100 min,Drama,Marcel L'Herbier,Marcel L'Herbier (scenario),"Ève Francis, Jaque Catelain, Marcelle Pradot, Philippe Hériat","Sibilla is a single mother, working as a gypsy dancer in a lousy cafe in the south of Spain. Unable to keep with the costs of his son's medical bills, she asks for help to Estiria, her ...","None, French",France,N/A,https://m.media-amazon.com/images/M/MV5BMTU5MTk4NzIyNV5BMl5BanBnXkFtZTgwMzYzNTYwMjE@._V1_SX300.jpg,"[{'Source': 'Internet Movie Database', 'Value': '7.0/10'}]",N/A,7.0,373,tt0012134,movie,N/A,N/A,N/A,N/A,True,
243,Enchantment,1921,Not Rated,30 Oct 1921,90 min,Comedy,Robert G. Vignola,"Frank R. Adams (story ""Manhandling Ethel""), Luther Reed","Marion Davies, Forrest Stanley, Edith Shayne, Tom Lewis",The frothy experiences of a vain little flapper. Her father induces an actor friend to become a gentlemanly cave man and the film becomes another variation of the 'Taming of the Shrew' ...,"None, English",USA,N/A,https://m.media-amazon.com/images/M/MV5BOTA1MTA5NTc2OV5BMl5BanBnXkFtZTgwMDg4NDAwNzE@._V1_SX300.jpg,"[{'Source': 'Internet Movie Database', 'Value': '6.4/10'}]",N/A,6.4,275,tt0012136,movie,15 Jan 2017,N/A,Cosmopolitan Productions,N/A,True,
244,Forbidden Fruit,1921,N/A,23 Jan 1921,87 min,Drama,Cecil B. DeMille,"Cecil B. DeMille (story ""The Golden Chance""), Jeanie Macpherson (screenplay), Jeanie Macpherson (story ""The Golden Chance"")","Agnes Ayres, Clarence Burton, Theodore Roberts, Kathlyn Williams",Mary Maddock becomes a seamstress after her husband Steve wastes their money on booze. Her employer provides her as an escort to accompany millionaire Mallory. Her husband tries ...,None,USA,N/A,https://m.media-amazon.com/images/M/MV5BYTdkY2E5ZDQtNTQ1Yi00MDQ3LWJjOGEtNGNmZWJjY2E4NTcyXkEyXkFqcGdeQXVyNjc1NTYyMjg@._V1_SX300.jpg,"[{'Source': 'Internet Movie Database', 'Value': '6.5/10'}]",N/A,6.5,131,tt0012187,movie,N/A,N/A,N/A,N/A,True,
245,The Four Horsemen of the Apocalypse,1921,Passed,01 Apr 1921,150 min,"Drama, Romance, War",Rex Ingram,"Vicente Blasco Ibáñez (novel), June Mathis (written for the screen by)","Pomeroy Cannon, Josef Swickard, Bridgetta Clark, Rudolph Valentino",An extended family split up in France and Germany find themselves on opposing sides of the battlefield during World War I.,None,USA,1 win.,https://m.media-amazon.com/images/M/MV5BZmU3OTJkMTctMDllNy00NDk1LTk2YzEtZTE3ZTQxNjc2ZjBjXkEyXkFqcGdeQXVyMTYzMTY1MjQ@._V1_SX300.jpg,"[{'Source': 'Internet Movie Database', 'Value': '7.2/10'}, {'Source': 'Rotten Tomatoes', 'Value': '80%'}]",N/A,7.2,"3,107",tt0012190,movie,08 Dec 2018,"$9,183,673",Metro,N/A,True,
246,Hamlet,1921,N/A,08 Nov 1921,131 min,Drama,"Svend Gade, Heinz Schall","Erwin Gepard (manuscript), Edward P. Vining (book)","Asta Nielsen, Paul Conradi, Mathilde Brandt, Eduard von Winterstein","Danish silent movie-star Asta Nielsen formed her own production company to make this film, in which new elements are combined with features (and a few lines) familiar from Shakespeare's ...","None, German",Germany,N/A,https://m.media-amazon.com/images/M/MV5BMTFhOTFmNTMtY2MzYy00NDg2LWFlODgtM2ZmMTIzYmFiMTJmXkEyXkFqcGdeQXVyNjA5MTAzODY@._V1_SX300.jpg,"[{'Source': 'Internet Movie Database', 'Value': '7.0/10'}, {'Source': 'Rotten Tomatoes', 'Value': '86%'}]",N/A,7.0,393,tt0012249,movie,N/A,N/A,N/A,N/A,True,
247,Hintertreppe,1921,N/A,02 Apr 1926,50 min,Drama,"Leopold Jessner, Paul Leni",Carl Mayer,"Henny Porten, Fritz Kortner, William Dieterle, Eugene Dieterle","A crippled mailman is in love with a maid who lives in the same building he does in one of the city's poor neighborhoods. She, however, is in love with a wealthy, handsome young man. ...",German,Germany,N/A,https://m.media-amazon.com/images/M/MV5BM2YxZWJjZWYtN2FkMi00N2VhLWI4NDAtNDdiMTQ0ZTFlOTAwXkEyXkFqcGdeQXVyMTc4MzI2NQ@@._V1_SX300.jpg,"[{'Source': 'Internet Movie Database', 'Value': '6.9/10'}]",N/A,6.9,146,tt0012281,movie,N/A,N/A,N/A,N/A,True,
248,"Mysteries of India, Part II: Above All Law",1921,N/A,12 Nov 2000,100 min,"Adventure, Fantasy",Joe May,"Thea von Harbou (novel), Fritz Lang (scenario), Thea von Harbou (scenario)","Olaf Fønss, Mia May, Conrad Veidt, Erna Morena","Howard is infected with leprosy, Mac Allen was captured by the Maharadsha, and now the Maharadsha offers Irene a deal: one night for letting healing Howard. She accepts, but when she tries ...","None, German",Germany,N/A,https://m.media-amazon.com/images/M/MV5BMTQ5OTIyNzA0M15BMl5BanBnXkFtZTgwNDY1NjkwMjE@._V1_SX300.jpg,"[{'Source': 'Internet Movie Database', 'Value': '6.7/10'}]",N/A,6.7,292,tt0012313,movie,18 Jul 2000,N/A,N/A,N/A,True,
249,"Mysteries of India, Part I: Truth",1921,N/A,N/A,120 min,"Adventure, Fantasy",Joe May,"Thea von Harbou (novel), Fritz Lang (scenario), Thea von Harbou (scenario)","Olaf Fønss, Mia May, Conrad Veidt, Erna Morena","First part of a serial spectacle, in which the unfaithful wife of a cruel Indian prince attempts to escape from his domination.","None, German",Germany,N/A,https://m.media-amazon.com/images/M/MV5BMTQ5OTIyNzA0M15BMl5BanBnXkFtZTgwNDY1NjkwMjE@._V1_SX300.jpg,"[{'Source': 'Internet Movie Database', 'Value': '6.6/10'}]",N/A,6.6,243,tt0012314,movie,N/A,N/A,N/A,N/A,True,
250,Johan,1921,N/A,28 Feb 1921,84 min,Drama,Mauritz Stiller,"Juhani Aho (novel), Mauritz Stiller, Arthur Nordén","Jenny Hasselqvist, Mathias Taube, Hildegard Harring, Urho Somersalmi","On a farm in up-country Sweden, an enigmatic stranger comes to a conservative peasant community and seduces a farmer's wife.",None,Sweden,N/A,https://m.media-amazon.com/images/M/MV5BMTYwOTQyNjkwMV5BMl5BanBnXkFtZTcwMjA3MTEyMg@@._V1_SX300.jpg,"[{'Source': 'Internet Movie Database', 'Value': '6.8/10'}]",N/A,6.8,224,tt0012334,movie,N/A,N/A,N/A,N/A,True,
251,The Kid,1921,Passed,06 Feb 1921,68 min,"Comedy, Drama, Family",Charles Chaplin,Charles Chaplin,"Carl Miller, Edna Purviance, Jackie Coogan, Charles Chaplin","The Tramp cares for an abandoned child, but events put that relationship in jeopardy.","None, English",USA,2 wins.,https://m.media-amazon.com/images/M/MV5BZjhhMThhNDItNTY2MC00MmU1LTliNDEtNDdhZjdlNTY5ZDQ1XkEyXkFqcGdeQXVyNjc1NTYyMjg@._V1_SX300.jpg,"[{'Source': 'Internet Movie Database', 'Value': '8.3/10'}, {'Source': 'Rotten Tomatoes', 'Value': '100%'}]",N/A,8.3,"115,515",tt0012349,movie,N/A,N/A,Charles Chaplin Productions,N/A,True,
252,The Phantom Carriage,1921,Not Rated,04 Jun 1922,107 min,"Drama, Fantasy, Horror",Victor Sjöström,"Selma Lagerlöf (novel), Victor Sjöström","Victor Sjöström, Hilda Borgström, Tore Svennberg, Astrid Holm","On New Year's Eve, the driver of a ghostly carriage forces a drunken man to reflect on his selfish, wasted life.","None, Swedish",Sweden,N/A,https://m.media-amazon.com/images/M/MV5BZDJjMzU4N2MtZDkxNi00YmRkLThkZjgtYzRlNzNlYjExNzAwXkEyXkFqcGdeQXVyNzQxNDExNTU@._V1_SX300.jpg,"[{'Source': 'Internet Movie Database', 'Value': '8.1/10'}, {'Source': 'Rotten Tomatoes', 'Value': '100%'}]",N/A,8.1,"11,026",tt0012364,movie,N/A,N/A,Svensk Filmindustri,N/A,True,
253,Leap Year,1924,Passed,11 Jan 1924,56 min,Comedy,"James Cruze, Roscoe 'Fatty' Arbuckle","Walter Woods (adapted by), Sarah Y. Mason (from the story by)","Roscoe 'Fatty' Arbuckle, Lucien Littlefield, Mary Thurman, John McKinnon","A young man, heir to his misogynistic and millionaire uncle, and in love with a nurse, gets in trouble when he gives advice on marriage to his girlfriends.","None, English",USA,N/A,https://m.media-amazon.com/images/M/MV5BMTI4NjE4MTAyMF5BMl5BanBnXkFtZTcwMDEzMTkyMQ@@._V1_SX300.jpg,"[{'Source': 'Internet Movie Database', 'Value': '6.1/10'}, {'Source': 'Rotten Tomatoes', 'Value': '57%'}]",N/A,6.1,275,tt0012382,movie,N/A,N/A,Paramount Pictures,N/A,True,
254,Little Lord Fauntleroy,1921,Passed,15 Sep 1921,112 min,Drama,"Alfred E. Green, Jack Pickford","Frances Hodgson Burnett (novel), Bernard McConville","Mary Pickford, Claude Gillingwater, Joseph J. Dowling, James A. Marcus",An American boy turns out to be the long-lost heir of a British fortune. He is sent to live with the cold and unsentimental lord who oversees the trust.,"None, English",USA,N/A,https://m.media-amazon.com/images/M/MV5BMzlkMGNhNzAtOWUyMC00ODdiLTk3MGItMmEwMTI3MjBiOGM0XkEyXkFqcGdeQXVyMjcxNjI4NTk@._V1_SX300.jpg,"[{'Source': 'Internet Movie Database', 'Value': '6.7/10'}, {'Source': 'Rotten Tomatoes', 'Value': '71%'}]",N/A,6.7,283,tt0012397,movie,15 Nov 2018,"$900,000",N/A,N/A,True,
255,The Love Light,1921,Unrated,09 Jan 1921,89 min,Drama,Frances Marion,Frances Marion,"Mary Pickford, Evelyn Dumo, Raymond Bloomer, Fred Thomson","Angela maintains a coastal lighthouse in Italy, where she awaits the return of her brothers from the war. She learns they are casualties and takes solace in the arms of an American sailor ...","None, English",USA,N/A,https://m.media-amazon.com/images/M/MV5BMzQ1OTQ1NTctYzhmMC00YTZmLWI5Y2QtMzY2NDgyODIxY2RiXkEyXkFqcGdeQXVyNjA5MTAzODY@._V1_SX300.jpg,"[{'Source': 'Internet Movie Database', 'Value': '6.5/10'}, {'Source': 'Rotten Tomatoes', 'Value': '50%'}]",N/A,6.5,341,tt0012408,movie,11 Aug 2016,"$690,965",Mary Pickford Company,N/A,True,
256,Miss Lulu Bett,1921,Not Rated,01 Nov 1921,71 min,"Comedy, Drama",William C. de Mille,"Clara Beranger (adaptation), Zona Gale (novel)","Lois Wilson, Milton Sills, Theodore Roberts, Helen Ferguson","A once-timid young woman gains newfound confidence after a failed marriage, much to the chagrin of her miserable family.",None,USA,1 win.,https://m.media-amazon.com/images/M/MV5BOWE2ZjE0MTgtMDBlYS00MzRjLTljODItY2E1YmM4MzhjZGQ3XkEyXkFqcGdeQXVyMzI5NjUyMDM@._V1_SX300.jpg,"[{'Source': 'Internet Movie Database', 'Value': '7.0/10'}]",N/A,7.0,316,tt0012465,movie,N/A,N/A,N/A,N/A,True,
257,My Boy,1921,N/A,01 Dec 1921,55 min,"Comedy, Drama","Albert Austin, Victor Heerman","Max Abramson (titles), Shirley Vance Martin (titles)","Mathilde Brundage, Claude Gillingwater, Jackie Coogan",An orphan escapes immigration officials at Ellis Island and goes to live with an old ship's master who can't find work and can't pay the rent.,"None, English",USA,N/A,https://m.media-amazon.com/images/M/MV5BNmVkY2ZhYmUtNzgyNS00Y2Q3LWEzZjYtYTJmNTIxNmIyOGQ4XkEyXkFqcGdeQXVyMDUyOTUyNQ@@._V1_SX300.jpg,"[{'Source': 'Internet Movie Database', 'Value': '6.2/10'}]",N/A,6.2,243,tt0012486,movie,N/A,N/A,N/A,N/A,True,
258,Destiny,1921,Not Rated,30 Jan 1922,114 min,"Drama, Fantasy, Thriller",Fritz Lang,"Fritz Lang, Thea von Harbou","Bernhard Goetzke, Lil Dagover, Walter Janssen, Hans Sternberg","When a woman's fiancé disappears, Death gives her three chances to save him from his fate.","None, German",Germany,2 nominations.,https://m.media-amazon.com/images/M/MV5BNmQxOGUwMDUtZjdmMC00MGRiLWE1MmItZjkyODdkYzY0YWZhL2ltYWdlXkEyXkFqcGdeQXVyMTg2NTc4MzA@._V1_SX300.jpg,"[{'Source': 'Internet Movie Database', 'Value': '7.6/10'}, {'Source': 'Rotten Tomatoes', 'Value': '90%'}]",N/A,7.6,"5,452",tt0012494,movie,10 Aug 2016,"$12,156",N/A,N/A,True,
259,The Nut,1921,Not Rated,06 Mar 1921,74 min,"Action, Comedy, Romance",Theodore Reed,"Kenneth Davenport (story), Douglas Fairbanks, William Parker (scenario), Lotta Woods (scenario)","Douglas Fairbanks, Marguerite De La Motte, William Lowery, Gerald Pring",Eccentric inventor Charlie Jackson tries to interest wealthy investors in his girlfriend's plan to help children from poor neighborhoods.,"None, English",USA,N/A,https://m.media-amazon.com/images/M/MV5BNmEzNjVhMmQtYzg0OC00Nzg1LWExZGItNmUwNzBkZjgwNjAxXkEyXkFqcGdeQXVyNjc4NTQxNjg@._V1_SX300.jpg,"[{'Source': 'Internet Movie Database', 'Value': '6.5/10'}]",N/A,6.5,211,tt0012513,movie,N/A,N/A,N/A,N/A,True,
260,Orphans of the Storm,1921,Not Rated,N/A,150 min,"Drama, History, Romance",D.W. Griffith,"Adolphe d'Ennery (novel), Eugène Cormon (novel), D.W. Griffith","Lillian Gish, Dorothy Gish, Joseph Schildkraut, Frank Losee","Two orphaned sisters are caught up in the turmoil of the French Revolution, encountering misery and love along the way.","None, English",USA,N/A,https://m.media-amazon.com/images/M/MV5BODRjNjU4ZjQtZDUyZi00MDY4LWI5MTAtYTMyNTAxYWNjZjA3XkEyXkFqcGdeQXVyMjcxNjI4NTk@._V1_SX300.jpg,"[{'Source': 'Internet Movie Database', 'Value': '7.3/10'}, {'Source': 'Rotten Tomatoes', 'Value': '92%'}]",N/A,7.3,"4,801",tt0012532,movie,28 Jul 2016,N/A,D.W. Griffith Productions,N/A,True,
261,Outside the Law,1920,Passed,06 Jan 1921,75 min,"Crime, Romance, Thriller",Tod Browning,"Gardner Bradford (titles), Tod Browning, Lucien Hubbard","Priscilla Dean, Wheeler Oakman, Lon Chaney, Ralph Lewis","In this early collaboration with director Tod Browning (Dracula, Freaks), Chaney delivers a dual performance of dramatic intensity, starring as Ah Wing, a kind-hearted student of Confucian ...","None, English",USA,N/A,https://m.media-amazon.com/images/M/MV5BZmIxNjFlMGEtZGQ4ZS00NzQyLWJiNDUtMGYwNmVjNWM3YmQzXkEyXkFqcGdeQXVyMjUxODE0MDY@._V1_SX300.jpg,"[{'Source': 'Internet Movie Database', 'Value': '6.6/10'}, {'Source': 'Rotten Tomatoes', 'Value': '100%'}]",N/A,6.6,494,tt0012538,movie,N/A,N/A,N/A,N/A,True,
262,Souls on the Road,1921,N/A,08 Apr 1921,91 min,Drama,Minoru Murata,"Maxim Gorky (story ""Na dne""), Wilhelm August Schmidtbonn (story ""Mutter Landstrasse""), Kiyohiko Ushihara","Kaoru Osanai, Haruko Sawamura, Denmei Suzuki, Mikiko Hisamatsu","A small town boy dreams of being a famous fiddler; meanwhile, two convicts escape from prison and hide in the woods","None, Japanese",Japan,N/A,https://m.media-amazon.com/images/M/MV5BNTViZDFiNjQtZmZlMC00NTFjLTk1MjQtNzdkY2UxZGMzYzAyXkEyXkFqcGdeQXVyNDk0MDg4NDk@._V1_SX300.jpg,"[{'Source': 'Internet Movie Database', 'Value': '6.7/10'}]",N/A,6.7,148,tt0012631,movie,N/A,N/A,N/A,N/A,True,
263,A Sailor-Made Man,1921,Passed,25 Dec 1921,47 min,Comedy,Fred C. Newmeyer,"Hal Roach (story), Sam Taylor (story), Jean C. Havez (story), H.M. Walker (titles)","Harold Lloyd, Mildred Davis, Noah Young, Dick Sutherland","An idle, wealthy playboy foolishly joins the Navy when the father of the girl he wants to marry tells him to get a job to prove himself worthy.","None, English",USA,N/A,https://m.media-amazon.com/images/M/MV5BNjA0ZDlkMTEtYjc1YS00ZDEwLWFhZTYtMmY0ZTczNjE4MzZmXkEyXkFqcGdeQXVyNjA5MTAzODY@._V1_SX300.jpg,"[{'Source': 'Internet Movie Database', 'Value': '6.9/10'}, {'Source': 'Rotten Tomatoes', 'Value': '46%'}]",N/A,6.9,979,tt0012642,movie,N/A,N/A,Hal Roach Studios Inc.,N/A,True,
264,Mad Love,1921,N/A,02 Jan 1922,82 min,Drama,Dimitri Buchowetzki,"Dimitri Buchowetzki, Alexandre Dumas (story)","Pola Negri, Johannes Riemann, Alfred Abel, Albert Steinrück","Richard De La Croix has a brother, Andreas, who has been driven insane by a notorious vamp and socialite named Sappho. A man-about-town named Teddy takes Richard to the Odeon to meet her, ...",None,Germany,N/A,https://m.media-amazon.com/images/M/MV5BNjdhMmU5NTEtNGY5Zi00YWE1LWI4NDYtNjJiMTI1YWMwODJiXkEyXkFqcGdeQXVyMTc4MzI2NQ@@._V1_SX300.jpg,"[{'Source': 'Internet Movie Database', 'Value': '6.7/10'}]",N/A,6.7,129,tt0012645,movie,N/A,N/A,N/A,N/A,True,
265,Scherben,1921,N/A,27 May 1921,50 min,Drama,Lupu Pick,"Carl Mayer, Lupu Pick","Werner Krauss, Edith Posca, Hermine Straßmann-Witt, Paul Otto","Set during the winter, the story tells the tale of a track checker and his family who live a poverty-stricken life next to a railway line. They receive a telegram announcing the arrival of ...","None, German",Germany,N/A,https://m.media-amazon.com/images/M/MV5BZDE3OTYxYjgtMzljNy00Nzc0LTkzZGMtYTU5YWZiODI1ZTQ2XkEyXkFqcGdeQXVyMjQ3MTQ1MTg@._V1_SX300.jpg,"[{'Source': 'Internet Movie Database', 'Value': '6.4/10'}]",N/A,6.4,221,tt0012650,movie,N/A,N/A,N/A,N/A,True,
266,The Haunted Castle,1921,Not Rated,07 Apr 1921,69 min,"Crime, Drama, Horror, Mystery",F.W. Murnau,"Rudolf Stratz (novel), Carl Mayer (adaptation)","Arnold Korff, Lulu Kyser-Korff, Lothar Mehnert, Paul Hartmann","In the castle Vogeloed, a few aristocrats are awaiting baroness Safferstätt. But first count Oetsch invites himself.. Everyone thinks he murdered his brother, baroness Safferstat's first ...","None, German",Germany,N/A,https://m.media-amazon.com/images/M/MV5BMDk1N2I5MTQtNDdlZS00ZmRjLWE4MTEtNTVjNDE3MDAxNWEyXkEyXkFqcGdeQXVyNzgzODI1OTE@._V1_SX300.jpg,"[{'Source': 'Internet Movie Database', 'Value': '6.2/10'}, {'Source': 'Rotten Tomatoes', 'Value': '32%'}]",N/A,6.2,"1,626",tt0012651,movie,N/A,N/A,N/A,N/A,True,
267,The Sheik,1921,Passed,20 Nov 1921,86 min,"Adventure, Drama, Romance",George Melford,"Edith Maude Hull (from the novel by), Monte M. Katterjohn (adaptation)","Rudolph Valentino, Agnes Ayres, Ruth Miller, George Waggner","A charming Arabian sheik becomes infatuated with an adventurous, modern-thinking Englishwoman and abducts her to his home in the Saharan desert.","None, English",USA,N/A,https://m.media-amazon.com/images/M/MV5BMjE5ODg4NDU3OV5BMl5BanBnXkFtZTgwNjA1NDIwMjE@._V1_SX300.jpg,"[{'Source': 'Internet Movie Database', 'Value': '6.3/10'}, {'Source': 'Rotten Tomatoes', 'Value': '91%'}]",N/A,6.3,"3,139",tt0012675,movie,02 Jul 2002,"$3,270,000",Famous Players-Lasky Corporation,N/A,True,
268,The Sky Pilot,1921,Not Rated,17 Apr 1921,77 min,Drama,King Vidor,"Ralph Connor (novel), Faith Green (adaptation), John McDermott","John Bowers, Colleen Moore, David Butler, Harry Todd",The sky pilot is a preacher who helps Gwen walk again after a near-fatal accident.,None,USA,N/A,https://m.media-amazon.com/images/M/MV5BODAzOTA3MjgtNjk4Ni00Nzc0LTlkZDQtYTUwMmEyNjk2MjdiXkEyXkFqcGdeQXVyMjcxNjI4NTk@._V1_SX300.jpg,"[{'Source': 'Internet Movie Database', 'Value': '5.9/10'}]",N/A,5.9,114,tt0012699,movie,N/A,N/A,N/A,N/A,True,
269,La terre,1921,N/A,15 Jul 1926,97 min,Drama,André Antoine,"André Antoine, Émile Zola (novel)","Armand Bour, René Alexandre, Germaine Rouer, Jean Hervé","As Jean is walking across the countryside in search of work, he helps and befriends a young woman, Françoise, who is having trouble controlling the cow that she is leading. Jean finds work ...","None, French",France,N/A,https://m.media-amazon.com/images/M/MV5BMTc1NzI3Mjc3N15BMl5BanBnXkFtZTgwNTMxMDgzMzE@._V1_SX300.jpg,"[{'Source': 'Internet Movie Database', 'Value': '6.9/10'}]",N/A,6.9,138,tt0012745,movie,09 Dec 2003,N/A,N/A,N/A,True,
270,The Three Musketeers,1921,N/A,28 Aug 1921,119 min,"Action, Adventure, Romance",Fred Niblo,"Alexandre Dumas (by: ""The Three Musketeers""), Edward Knoblock (adapted by), Lotta Woods (scenario editor)","Adolphe Menjou, Mary MacLaren, Nigel De Brulier, Thomas Holding","The young Gascon D'Artagnan arrives in Paris, his heart set on joining the king's Musketeers. He is taken under the wings of three of the most respected and feared Musketeers, Porthos, ...","None, English",USA,N/A,https://m.media-amazon.com/images/M/MV5BYjNmYWY3MjAtZDU1My00Nzk2LWE2ZTItMzc0ODkyMjYzNjBlXkEyXkFqcGdeQXVyMTE2NzA0Ng@@._V1_SX300.jpg,"[{'Source': 'Internet Movie Database', 'Value': '7.0/10'}, {'Source': 'Rotten Tomatoes', 'Value': '100%'}]",N/A,7.0,869,tt0012752,movie,N/A,"$3,270,000",Douglas Fairbanks Pictures,N/A,True,
271,Through the Back Door,1921,N/A,05 May 1921,89 min,"Comedy, Drama","Alfred E. Green, Jack Pickford","Gerald C. Duffy, Marion Fairfax","Mary Pickford, Gertrude Astor, Wilfred Lucas, Helen Raymond","When her mother remarries, a young Belgian girl is left behind with her nurse, but when Germany invades the country, she is sent to America to find her mother.","None, English",USA,N/A,https://m.media-amazon.com/images/M/MV5BZWQ1ZGZjMmQtZmI2Ny00YThjLWEwZWUtOWNkNWU3ZTcxZWM1XkEyXkFqcGdeQXVyMjcxNjI4NTk@._V1_SX300.jpg,"[{'Source': 'Internet Movie Database', 'Value': '6.8/10'}, {'Source': 'Rotten Tomatoes', 'Value': '38%'}]",N/A,6.8,165,tt0012755,movie,03 May 2005,N/A,N/A,N/A,True,
272,Tol'able David,1921,N/A,31 Dec 1921,99 min,Drama,Henry King,"Joseph Hergesheimer (novel), Edmund Goulding, Henry King","Richard Barthelmess, Gladys Hulette, Walter P. Lewis, Ernest Torrence","When three thuggish men are responsible for the death of his father and the crippling of his brother, young David must choose between supporting his family or risking his life and exacting vengeance.",None,USA,2 wins.,https://m.media-amazon.com/images/M/MV5BMjIwMzA3MDAyNl5BMl5BanBnXkFtZTgwNzMyNTE1MjE@._V1_SX300.jpg,"[{'Source': 'Internet Movie Database', 'Value': '6.8/10'}, {'Source': 'Rotten Tomatoes', 'Value': '74%'}]",N/A,6.8,"1,753",tt0012763,movie,23 Mar 1999,N/A,N/A,N/A,True,
273,Too Wise Wives,1921,PASSED,22 May 1921,80 min,Drama,Lois Weber,"Lois Weber (story), Marion Orth (story)","Louis Calhern, Claire Windsor, Phillips Smalley, Mona Lisa",An insecure wife fears her husband may be straying back to an old flame.,English,USA,N/A,https://m.media-amazon.com/images/M/MV5BYTEyN2NhZWQtNWFkOS00NjQ2LWEzODYtYmU4OWViMWMxYjE0XkEyXkFqcGdeQXVyNDA3OTk2OTY@._V1_SX300.jpg,"[{'Source': 'Internet Movie Database', 'Value': '6.1/10'}]",N/A,6.1,117,tt0012769,movie,N/A,N/A,Lois Weber Productions,N/A,True,
274,Vier um die Frau,1921,Not Rated,21 Jan 1990,52 min,Drama,Fritz Lang,"Fritz Lang, Rolf E. Vanloo (play), Thea von Harbou","Hermann Böttcher, Carola Toelle, Lilli Lohrer, Ludwig Hartau","Harry Yquem, a wealthy broker, remains obsessed with delusions of his devout wife's infidelity.","None, German",Germany,N/A,https://m.media-amazon.com/images/M/MV5BMzc3Mjk5ODAtODU2OC00Yzc5LTkyNmItN2U0M2E0MjI5MzU1XkEyXkFqcGdeQXVyMDY4MzkyNw@@._V1_SX300.jpg,"[{'Source': 'Internet Movie Database', 'Value': '6.2/10'}, {'Source': 'Rotten Tomatoes', 'Value': '50%'}]",N/A,6.2,351,tt0012806,movie,17 Apr 2020,N/A,N/A,N/A,True,
275,Beauty's Worth,1922,Passed,14 May 1922,112 min,"Drama, Romance",Robert G. Vignola,"Sophie Kerr (story), Luther Reed (scenario)","Marion Davies, Forrest Stanley, June Elvidge, Truly Shattuck","Prudence Cole is an unsophisticated Quaker girl being raised by her two aunts. Prudence is flirted with by snobbish Henry Garrison, who actually disdains the girl for her lack of ...","None, English",USA,N/A,https://m.media-amazon.com/images/M/MV5BNTM4ZTg2NjMtNmU3Mi00NThiLWE1ZGYtMGY1YTRjNzc1ODgxL2ltYWdlL2ltYWdlXkEyXkFqcGdeQXVyMTE2NzA0Ng@@._V1_SX300.jpg,"[{'Source': 'Internet Movie Database', 'Value': '6.1/10'}]",N/A,6.1,775,tt0012928,movie,N/A,N/A,N/A,N/A,True,
276,Beyond the Rocks,1922,Passed,07 May 1922,80 min,"Drama, Romance",Sam Wood,"Elinor Glyn (based on the novel by), Jack Cunningham (scenario)","Gloria Swanson, Rudolph Valentino, Edythe Chapman, Alec B. Francis",A young woman marries an older millionaire and then falls in love with a handsome nobleman on her honeymoon.,None,USA,N/A,https://m.media-amazon.com/images/M/MV5BOTQ0NDQyNzQyOF5BMl5BanBnXkFtZTgwOTQ5Mzc0MjE@._V1_SX300.jpg,"[{'Source': 'Internet Movie Database', 'Value': '6.7/10'}, {'Source': 'Rotten Tomatoes', 'Value': '86%'}]",N/A,6.7,"2,225",tt0012938,movie,15 Sep 2009,"$265,150",Famous Players-Lasky Corporation,N/A,True,
